{"$schema":"https://json-schema.org/draft/2020-12/schema","$id":"https://zambo.dev/aer1/schema/0.3/receipt.json","title":"AER-1 Execution Receipt","type":"object","additionalProperties":true,"required":["id","receipt_schema_version","created_at","tool","provenance_class","canonical_bytes","output_hash","verification_status"],"properties":{"id":{"type":"string","pattern":"^[0-9a-fA-F]{8}-[0-9a-fA-F]{4}-4[0-9a-fA-F]{3}-[89abAB][0-9a-fA-F]{3}-[0-9a-fA-F]{12}$"},"receipt_schema_version":{"const":"0.3"},"created_at":{"type":"string","pattern":"^\\d{4}-\\d{2}-\\d{2}T\\d{2}:\\d{2}:\\d{2}(?:\\.\\d+)?(?:Z|[+-]\\d{2}:\\d{2})$"},"tool":{"type":"object","required":["name","version","scope"],"additionalProperties":true,"properties":{"name":{"type":"string","minLength":1},"version":{"type":"string","minLength":1},"scope":{"type":"string","minLength":1}}},"provenance_class":{"type":"string","minLength":1},"canonical_bytes":{"type":"string","pattern":"^[A-Za-z0-9+/]*={0,2}$"},"output_hash":{"type":"string","pattern":"^sha256:[0-9a-f]{64}$"},"verification_status":{"enum":["verified"]},"anchor":{"type":"object","additionalProperties":true,"properties":{"log":{"type":"string"},"leaf_hash":{"type":"string","pattern":"^sha256:[0-9a-f]{64}$"},"anchored_at":{"type":"string","pattern":"^\\d{4}-\\d{2}-\\d{2}T\\d{2}:\\d{2}:\\d{2}(?:\\.\\d+)?(?:Z|[+-]\\d{2}:\\d{2})$"},"proof":{"type":"object"}}}}}